{
  "identity": {
    "archetype": "infographic-dense",
    "one_line": "생활 속 돈 새는 구멍을 표와 체크리스트로 정리해 주는 계정",
    "target_reader": "고정비를 줄이고 싶은 사회초년생"
  },
  "visual": {
    "palette": {
      "primary": [
        "#1a1a1a"
      ],
      "accent": [
        "#d94f30"
      ],
      "background": [
        "#faf7f2"
      ],
      "text": [
        "#1a1a1a"
      ],
      "usage_ratio": {
        "bg": 0.72,
        "primary": 0.2,
        "accent": 0.08
      }
    },
    "typography": {
      "headline": {
        "family": "Pretendard",
        "fallback": [
          "Noto Sans KR",
          "sans-serif"
        ],
        "weight": 700,
        "size_ratio": 0.072,
        "letter_spacing_em": -0.012,
        "line_height": 1.26,
        "case": "as-is"
      },
      "body": {
        "family": "Pretendard",
        "fallback": [
          "Noto Sans KR",
          "sans-serif"
        ],
        "weight": 400,
        "size_ratio": 0.032,
        "letter_spacing_em": -0.005,
        "line_height": 1.7
      },
      "accent": {
        "family": "Pretendard",
        "fallback": [
          "Noto Sans KR",
          "sans-serif"
        ],
        "weight": 700,
        "size_ratio": 0.024,
        "letter_spacing_em": 0.04,
        "line_height": 1.4,
        "case": "upper"
      },
      "korean_font": "Pretendard",
      "chinese_font": "Noto Sans SC",
      "latin_font": "Pretendard",
      "mixed_script_rule": "Pretendard → Noto Sans SC → sans-serif"
    },
    "layout": {
      "safe_margin_ratio": 0.11,
      "text_zone": "top",
      "text_block_max_lines": 5,
      "alignment": "center",
      "grid": "single",
      "decorations": [
        "number-badge",
        "underline-highlight"
      ]
    },
    "imagery": {
      "type_mix": {
        "photo": 0.1,
        "illustration": 0.1,
        "solid_or_gradient": 0.8
      },
      "treatment": [
        "high-contrast"
      ],
      "grain_intensity": 0.0,
      "subject_rules": "인물은 거의 등장하지 않고 표·숫자·아이콘 위주",
      "overlay": {
        "type": "none",
        "opacity": 0.0
      }
    }
  },
  "structure": {
    "slide_count_range": [
      6,
      9
    ],
    "slide_count_mode": 8,
    "hook_type": "question",
    "narrative_pattern": "problem-solution",
    "slide_roles_sequence": [
      "hook",
      "context",
      "point",
      "point",
      "point",
      "proof",
      "summary",
      "cta"
    ],
    "cta_type": "save",
    "cover_rule": "title+sub+badge"
  },
  "copy": {
    "language": "ko",
    "register": "존댓말 · 해요체 혼용",
    "sentence_length_avg": 24,
    "headline_char_limit": 26,
    "body_char_limit_per_slide": 90,
    "emoji_density": 0.02,
    "emoji_palette": [
      "✨",
      "💡"
    ],
    "punctuation_habits": "느낌표를 자주 씁니다. 질문형 문장을 섞습니다",
    "signature_phrases": [
      "오늘 바로",
      "확인해 보세요"
    ],
    "forbidden_words": [
      "존버",
      "떡상",
      "가즈아"
    ]
  },
  "caption": {
    "length_range": [
      280,
      700
    ],
    "first_line_rule": "질문으로 시작해 독자가 자기 상황을 떠올리게 합니다",
    "structure": [
      "hook",
      "body",
      "line_break",
      "cta",
      "hashtag_block"
    ],
    "hashtag_strategy": {
      "count": 9,
      "mix": {
        "broad": 3,
        "niche": 4,
        "branded": 1,
        "community": 1
      },
      "placement": "end"
    }
  },
  "evidence": {
    "sampled_posts": 0,
    "notes": "M3 왕복 검증용 정답 DNA. 실제 계정에서 추출한 값이 아니라 손으로 적은 값이다. register는 처음에 '존댓말'로 적었으나, 함께 쓴 캡션을 직접 세어 보니 합쇼체 11 : 해요체 12로 실제로 혼용이었다. 출력에 맞춘 것이 아니라 틀린 라벨을 고친 것이다 — 혼용 판정 경로를 검증하는 픽스처이기도 하다.",
    "low_confidence_fields": []
  }
}
